Athens; Blue and White; Dranchmas; ???; Aegen Sea, Pindus Mountains; Figs, Olives; ???; Plato, Spartans; Greek; ???; ???; Prime Minister; Hellenic Republic, Neighbors Yugoslavia
Baghdag; Red, White, and Black; Dinars; Desert; Syrian Desert, Euphrates River, Tigris River; Oil; Arabian Gazelles; Sumarian; ???; ???; ???; ???; Mezopotamia
Bamako; Green, Yellow, and Red; Francs; ???; Niger River, Sahara; Millet, Rice; ???; Tuaregs; ???; ???; ???; President; Timbuktu
Bangkok; Red, White, and Blue; Baths; ???; ???; ???; ???; ???; ???; ???; Buddhism; ???; Ancient Siam
Budapest; Red, White, and Green; Forints; ???; Alpold Plains, Danube River; Grapes; ???; Croation, Gypsies; ???; Magyar Art; ???; ???; Neighbors Austria
Buenos Aires; Sun Flag; Australes; ???; Parana River, Tierra del Fuego; Cattle; ???; Gauchos; ???; ???; ???; President; Former Spanish Colony
Cairo; ???; Pounds; ???; Pharoahs Tomb, Sinai Desert; Limestone; ???; Nubian; ???; ???; ???; ???; Ancient Alexandria
